<?xml version="1.0" encoding="UTF-8"?>
<xs:schema xmlns:xs="http://www.w3.org/2001/XMLSchema" targetNamespace="http://example/mapper">
  <xs:element name="mapper">
    <xs:complexType>
      <xs:sequence>
        <xs:element name="name" type="xs:string"/>
        <xs:element name="description" type="xs:string"/>
        <xs:element name="inputs">
          <xs:complexType>
            <xs:sequence>
              <xs:element name="input" maxOccurs="unbounded">
                <xs:complexType>
                  <xs:sequence>
                    <xs:element name="name" type="xs:string"/>
                    <xs:element name="type" type="xs:string"/>
                    <xs:element name="referenceName" type="xs:string"/>
                  </xs:sequence>
                </xs:complexType>
              </xs:element>
            </xs:sequence>
          </xs:complexType>
        </xs:element>
        <xs:element name="maps">
          <xs:complexType>
            <xs:sequence>
              <xs:element name="map" maxOccurs="unbounded">
                <xs:complexType>
                  <xs:sequence>
                    <xs:element name="name" type="xs:string"/>
                    <xs:element name="inputs">
                      <xs:complexType>
                        <xs:sequence>
                          <xs:element name="input" maxOccurs="unbounded">
                            <xs:complexType>
                                <xs:sequence>
                                  <xs:element name="source" type="xs:string"/>
                                  <xs:element name="formula" type="xs:string"/>
                                  <xs:element name="comments" type="xs:string" minOccurs="0"/>
                                </xs:sequence>
                            </xs:complexType>
                          </xs:element>
                        </xs:sequence>
                      </xs:complexType>
                    </xs:element>
                    <xs:element name="outputType">
                        <xs:simpleType >
                            <xs:restriction base="xs:string">
                                <xs:enumeration value="string"/>
                                <xs:enumeration value="date"/>
                            </xs:restriction> 
                        </xs:simpleType> 
                    </xs:element>
                    <xs:element name="customLogic" type="xs:string"/>
                  </xs:sequence> 
                </xs:complexType> 
              </xs:element> 
            </xs:sequence> 
          </xs:complexType> 
        </xs:element> 
      </xs:sequence> 
    </xs:complexType> 
  </xs:element> 
</xs:schema> 
