<?xml version="1.0" encoding="UTF-8"?>
<?xml-stylesheet type="text/xsl" href="../xml-transformations/data-mapper-to-html.xsl"?>
<mapper xmlns:xsi="http://www.w3.org/2001/XMLSchema-instance"
    xsi:schemaLocation="http://example/mapper ../schemas/data-mapper.xsd"
    xmlns="http://example/mapper"
    xmlns:m="http://example/mapper" generate-code="true">
    <name>From Test to Stat Entry</name>
    <comments>
        Maps from a test taken to a score to be added to the statistical software.
    </comments>
    <outputType>StatEntry</outputType>
    <inputs>
        <input>
            <name>Test Record</name>
            <type>Test</type>
            <referenceName>test</referenceName>
        </input>
        <input>
            <name>Population Test Statistics</name>
            <type>TestSummary</type>
            <referenceName>Stats</referenceName>
        </input>
    </inputs>
    <maps>
        <map>
            <name>Adjusted Score</name>
            <outputTo>AdjustedScore</outputTo>
            <outputType>string</outputType>
            <comments>divide score by average of population, multiplied by the number of days ago
                that DateTaken</comments>
            <inputs generate-code="true">
                <input>
                    <source>test</source>
                    <formula>DateTaken</formula>
                </input>
                <input>
                    <source>test</source>
                    <formula>Score</formula>
                </input>
                <input>
                    <source>Stats</source>
                    <formula>Scores.Avg</formula>
                    <comments>The avg of the whole population</comments>
                </input>
            </inputs>
        </map>
        <map>
            <name>End of Month</name>
            <outputTo>Eom</outputTo>
            <outputType>DateTime</outputType>
            <comments>the last date of the month when the test was taken</comments>
            <inputs>
                <input>
                    <source>test</source>
                    <formula>DateTaken</formula>
                    <comments>Must be the month where the test was taken</comments>
                </input>
            </inputs>
        </map>
        <map generate-code="true">
            <name>Next Test Probability</name>
            <outputTo>NextTestProb</outputTo>
            <outputType>decimal</outputType>
            <comments></comments>
            <formula>testScore * stdScore</formula>
            <inputs>
                <input>
                    <source>test</source>
                    <formula>Score</formula>
                    <referenceName>testScore</referenceName>
                </input>
                <input>
                    <source>Stats</source>
                    <formula>Scores.StdScore</formula>
                    <comments></comments>
                    <referenceName>stdScore</referenceName>
                </input>
            </inputs>
        </map>

        <map generate-code="true">
            <outputTo>FinalScore</outputTo>
            <outputType>decimal</outputType>
            <formula>test.MyScore</formula>
            <example>12.0</example>
        </map>
    </maps>
</mapper>